<?xml version="1.0" encoding="ISO-8859-1" ?>
<actions xmlns:xsi="http://www.w3.org/2001/XMLSchema-instance" xsi:noNamespaceSchemaLocation="../schemas/action.xsd">
    <action>
        
        <type>dataCopy</type>
        <version>1</version>
        <name>Data copy</name>	        
	    <class>com.rapid.actions.Datacopy</class>	 
	    
	    <addToNewApplications>true</addToNewApplications>
	    
	    <properties>
	    
	        <property>
	            <key>dataSource</key>
	            <name>Source</name>
	            <changeValueJavaScript>select</changeValueJavaScript>
	            <getValuesFunction>
	                <![CDATA[
return "<option value=''>None</option>" + getInputOptions(this.dataSource);         
	                ]]>
	            </getValuesFunction>	
	        </property>
	        
	        <property>
	            <key>dataSourceField</key>
	            <name>Source field</name>
	            <changeValueJavaScript>text</changeValueJavaScript>
	            <getValuesFunction>return "";</getValuesFunction>
	        </property>	  
	        
	        <property>
	            <key>dataDestinations</key>
	            <name>Destinations</name>
	            <changeValueJavaScript>dataDestinations</changeValueJavaScript> 
	        </property>  
	          
	    </properties>	    
	    <actionJavaScript>
	        <![CDATA[ 
function Action_datacopy(data, outputs) {
	if (outputs) {
		for (var i in outputs) {
			var output = outputs[i];			
			window["setData_" + output.type](output.id, data, output.field, output.details);
		}
	}
}	        ]]>
	    </actionJavaScript>
	       
    </action>     
</actions>