<?xml version="1.0" encoding="UTF-8" ?>
<actions xmlVersion="1" xmlns:xsi="http://www.w3.org/2001/XMLSchema-instance" xsi:noNamespaceSchemaLocation="../schemas/action.xsd">

<!-- 

Copyright (C) 2018 - Gareth Edwards / Rapid Information Systems

gareth.edwards@rapid-is.co.uk


This file is part of the Rapid Application Platform

Rapid is free software: you can redistribute it and/or modify
it under the terms of the GNU General Public License as published by
the Free Software Foundation, either version 3 of the License, or
(at your option) any later version. The terms require you to include
the original copyright, and the license notice in all redistributions.

This program is distributed in the hope that it will be useful,
but WITHOUT ANY WARRANTY; without even the implied warranty of
MERCHANTABILITY or FITNESS FOR A PARTICULAR PURPOSE.  See the
GNU General Public License for more details.

You should have received a copy of the GNU General Public License
in a file named "COPYING".  If not, see <http://www.gnu.org/licenses/>.

 -->

    <action>
    
        <type>event</type>
        <name>Event</name>
	    <class>com.rapid.actions.Event</class>
	    <helpHtml>This action offers a complete list of all available events on the page. Selecting any event from this action will trigger all of the associated actions on that particular event.</helpHtml>
	    
	    <addToNewApplications>false</addToNewApplications>
	    	    	    	    
	    <properties>
	        
	        <property>
	            <key>event</key>
	            <name>Event</name>
	            <changeValueJavaScript>select</changeValueJavaScript>
	            <getValuesFunction>
	                <![CDATA[
return "<option value=''>None</option>" + getEventOptions(this.event);
	                ]]>
	            </getValuesFunction>
	            <helpHtml>Selects a set of actions to be carried out as a single event, all at once.</helpHtml>
	        </property>
	        
	    </properties>
	    	   	    	    	    	    	     	     	    
    </action>
</actions>