<?xml version="1.0" encoding="ISO-8859-1" ?>
<actions xmlVersion="1" xmlns:xsi="http://www.w3.org/2001/XMLSchema-instance" xsi:noNamespaceSchemaLocation="../schemas/action.xsd">

<!-- 

Copyright (C) 2014 - Gareth Edwards / Rapid Information Systems

gareth.edwards@rapid-is.co.uk


This file is part of the Rapid Application Platform

RapidSOA is free software: you can redistribute it and/or modify
it under the terms of the GNU General Public License as published by
the Free Software Foundation, either version 3 of the License, or
(at your option) any later version. The terms require you to include
the original copyright, and the license notice in all redistributions.

This program is distributed in the hope that it will be useful,
but WITHOUT ANY WARRANTY; without even the implied warranty of
MERCHANTABILITY or FITNESS FOR A PARTICULAR PURPOSE.  See the
GNU General Public License for more details.

You should have received a copy of the GNU General Public License
in a file named "COPYING".  If not, see <http://www.gnu.org/licenses/>.

 -->

    <action>
    
        <type>form</type>        
        <name>Form</name>	        
	    <class>com.rapid.actions.Form</class>
	    
	    <addToNewApplications>false</addToNewApplications>
	     
<!-- 

This action runs form - specifc functions
		
-->	    	
	    <properties>
	        	        
	        <property>
	            <key>actionType</key>
	            <name>Action</name>
	            <setConstructValueFunction>return ""</setConstructValueFunction>
	            <changeValueJavaScript>select</changeValueJavaScript>	 	            
	            <getValuesFunction>return [["","Please select..."],["next","next page"],["prev","previous page"],["id","copy form id"],["val","copy form value"],["err","copy form error message"],["res","copy form resume url"],["pdf","copy form pdf url"]];</getValuesFunction>	            
	            <refreshProperties>true</refreshProperties>	            
	        </property>
	        
	        <property>
	            <key>dataSource</key>
	            <name>Source</name>
	            <changeValueJavaScript>formDataSource</changeValueJavaScript> 
	            <getValuesFunction>
	                 <![CDATA[
	                // return the list of all controls on the page with the one for this action selected
	                return "<option value=''>Please select...</option>" + getFormValueOptions(this.dataSource);
	               	]]>
	            </getValuesFunction>
	        </property>
	        
	        <property>
	            <key>dataDestination</key>
	            <name>Destination</name>
	            <changeValueJavaScript>formDataDestination</changeValueJavaScript> 
	            <getValuesFunction>
	                 <![CDATA[
	                // return the list of all controls on the page with the one for this action selected
	                return "<option value=''>Please select...</option>" + getOutputOptions(this.dataDestination);
	               	]]>
	            </getValuesFunction>
	        </property>
	        
		</properties>
	
	    <resources>
	        <resource>
	            <type>css</type>
	            <contents>
	    			<![CDATA[
	    			
.formSummaryTitle {
	margin-left:20px;
}	    			
	    			
.formSummaryPage {
	margin-left:20px;
	margin-right:20px;
	margin-bottom:20px;
	padding: 10px;
	border: 3px solid black;
}

.formSummaryPage h2 {
	margin-top:0;
}

.formSummaryPage a {
	float: right;
	position:relative;
	top: -20px
}

.formSummaryControl {
	display: block;
	margin-bottom:5px;
}

.formSummarySubmit {
	margin-left:20px;
}		    			
	    			]]>        
	            </contents>
	        </resource>
	    </resources>
	        		    	        
    </action> 
</actions>