<?xml version="1.0" encoding="UTF-8" ?>
<actions xmlVersion="1" xmlns:xsi="http://www.w3.org/2001/XMLSchema-instance" xsi:noNamespaceSchemaLocation="../schemas/action.xsd">

<!-- 

Copyright (C) 2017 - Gareth Edwards / Rapid Information Systems

gareth.edwards@rapid-is.co.uk


This file is part of the Rapid Application Platform

Rapid is free software: you can redistribute it and/or modify
it under the terms of the GNU General Public License as published by
the Free Software Foundation, either version 3 of the License, or
(at your option) any later version. The terms require you to include
the original copyright, and the license notice in all redistributions.

This program is distributed in the hope that it will be useful,
but WITHOUT ANY WARRANTY; without even the implied warranty of
MERCHANTABILITY or FITNESS FOR A PARTICULAR PURPOSE.  See the
GNU General Public License for more details.

You should have received a copy of the GNU General Public License
in a file named "COPYING".  If not, see <http://www.gnu.org/licenses/>.

 -->

    <action>
    
        <type>group</type>
        <name>Group</name>
	    <class>com.rapid.actions.Group</class>
	    <helpHtml>Enables multiple action calls in a single event. This is useful for when you want to trigger many events without taking up a lot of space. Related actions can be recalled, be formed in logical groups and can be reused in a single step. Grouped actions are also useful for page reuse events.</helpHtml>
	      
	    <properties>
	        	        
	        <property>
	            <key>actions</key>
	            <name>Actions</name>
	            <changeValueJavaScript>childActions</changeValueJavaScript>
	            <helpHtml>Add actions to this group to tidy your application, or re-use all actions in the group.</helpHtml>
	        </property>
	        	            
	    </properties>
	    	   	    	    	    	    	     	     	    
    </action>
</actions>