<?xml version="1.0" encoding="ISO-8859-1" ?>
<actions xmlVersion="1" xmlns:xsi="http://www.w3.org/2001/XMLSchema-instance" xsi:noNamespaceSchemaLocation="../schemas/action.xsd">

<!-- 

Copyright (C) 2014 - Gareth Edwards / Rapid Information Systems

gareth.edwards@rapid-is.co.uk


This file is part of the Rapid Application Platform

RapidSOA is free software: you can redistribute it and/or modify
it under the terms of the GNU General Public License as published by
the Free Software Foundation, either version 3 of the License, or
(at your option) any later version. The terms require you to include
the original copyright, and the license notice in all redistributions.

This program is distributed in the hope that it will be useful,
but WITHOUT ANY WARRANTY; without even the implied warranty of
MERCHANTABILITY or FITNESS FOR A PARTICULAR PURPOSE.  See the
GNU General Public License for more details.

You should have received a copy of the GNU General Public License
in a file named "COPYING".  If not, see <http://www.gnu.org/licenses/>.

 -->

    <action>
    
        <type>mobile</type>
        <name>Mobile</name>	        
	    <class>com.rapid.actions.Mobile</class>
	    
	    <addToNewApplications>false</addToNewApplications>
<!-- 

This action runs actions that already exist on other controls		
		
-->	    	
		<properties>
		    
	        <property>
	            <key>actionType</key>
	            <name>Type</name>
	            <setConstructValueFunction>return "dial";</setConstructValueFunction>
	            <changeValueJavaScript>mobileActionType</changeValueJavaScript>	 
	            <refreshProperties>true</refreshProperties>
	        </property>
	        
	        <property>
	            <key>numberControlId</key>
	            <name>Phone number source</name>
	             <visible>false</visible>
	            <changeValueJavaScript>select</changeValueJavaScript>	 
	             <getValuesFunction>
	                <![CDATA[
return "<option value=''>Please select...</option>" + getInputOptions(this.numberControlId);	                
	                ]]>
	            </getValuesFunction>
	        </property>
	        
	        <property>
	            <key>numberField</key>
	            <name>Phone number source field</name>
	             <visible>false</visible>
	            <changeValueJavaScript>text</changeValueJavaScript>	 
	        </property>
	        
	        <property>
	            <key>messageControlId</key>
	            <name>Message source</name>
	             <visible>false</visible>
	            <changeValueJavaScript>select</changeValueJavaScript>	
	             <getValuesFunction>
	                <![CDATA[
return "<option value=''>Please select...</option>" + getInputOptions(this.messageControlId);	                
	                ]]>
	            </getValuesFunction> 	           
	        </property>
	        
	        <property>
	            <key>messageField</key>
	            <name>Message source field</name>
	             <visible>false</visible>
	            <changeValueJavaScript>text</changeValueJavaScript>	 	            
	        </property>
	        
	        <property>
	            <key>galleryControlId</key>
	            <name>Gallery control</name>
	            <visible>false</visible>
	            <changeValueJavaScript>select</changeValueJavaScript>
	            <getValuesFunction>
	                <![CDATA[
return "<option value=''>Please select...</option>" + getControlOptions(this.galleryControlId, null, "gallery");	                
	                ]]>
	            </getValuesFunction>	 	            
	        </property>
	        
	        <property>
	            <key>imageMaxSize</key>
	            <name>Max width/height (px)</name>
	            <visible>false</visible>
	            <setConstructValueFunction>return "500";</setConstructValueFunction>
	            <changeValueJavaScript>integer</changeValueJavaScript>	 
	        </property>
	        
	        <property>
	            <key>imageQuality</key>
	            <name>Quality (%)</name>
	            <visible>false</visible>
	            <setConstructValueFunction>return "50";</setConstructValueFunction>
	            <changeValueJavaScript>integer</changeValueJavaScript>	 
	        </property>
	        
	         <property>
	            <key>galleryControlIds</key>
	            <name>Controls</name>
	            <visible>false</visible>
	            <changeValueJavaScript>galleryControls</changeValueJavaScript>	            
	            <refreshProperties>true</refreshProperties>
	        </property>
	        
	         <property>
	            <key>barcodeDestinations</key>
	            <name>Destinations</name>
	            <visible>false</visible>
	            <changeValueJavaScript>datacopyDestinations</changeValueJavaScript>	 
	        </property> 
	        
	        <property>
	            <key>successActions</key>
	            <name>Success actions</name>
	            <visible>false</visible>
	            <changeValueJavaScript>childActions</changeValueJavaScript>	 
	        </property>
	        
	        <property>
	            <key>errorActions</key>
	            <name>Error actions</name>
	            <visible>false</visible>
	            <changeValueJavaScript>childActions</changeValueJavaScript>	 
	        </property> 
	        	        
	        <property>
	            <key>navigateControlId</key>
	            <name>Navigate to source</name>
	             <visible>false</visible>
	            <changeValueJavaScript>select</changeValueJavaScript>	 
	             <getValuesFunction>
	                <![CDATA[
return "<option value=''>Please select...</option>" + getInputOptions(this.navigateControlId);	                
	                ]]>
	            </getValuesFunction>
	        </property>
	        
	        <property>
	            <key>navigateField</key>
	            <name>Navigate to source field</name>
	             <visible>false</visible>
	            <changeValueJavaScript>text</changeValueJavaScript>	 
	        </property>
	        
	         <property>
	            <key>navigateMode</key>
	            <name>Navigation mode</name>
	            <visible>false</visible>	            
	            <setConstructValueFunction>
	                <![CDATA[
return "d";	                
	                ]]>
	            </setConstructValueFunction>
	            <changeValueJavaScript>select</changeValueJavaScript>
	            <getValuesFunction>
	                <![CDATA[
return [["d","driving"],["w","walking"],["b","cycling"],["transit","public transport"]];	                
	                ]]>
	            </getValuesFunction>	 	            
	        </property>
	        
	        <property>
	            <key>message</key>
	            <name>Message</name>
	            <visible>false</visible>
	            <changeValueJavaScript>bigtext</changeValueJavaScript>	 
	        </property>
	        	        	        
	        <property>
	            <key>gpsDestinations</key>
	            <name>Destinations</name>
	            <visible>false</visible>
	            <changeValueJavaScript>datacopyDestinations</changeValueJavaScript>	 
	        </property> 
         	        
	        <property>
	            <key>gpsFrequency</key>
	            <name>Update frequency (seconds)</name>
	            <visible>false</visible>
	            <setConstructValueFunction>return 0;</setConstructValueFunction>
	            <changeValueJavaScript>integer</changeValueJavaScript>	 
	        </property>
	        
	        <property>
	            <key>gpsCheck</key>
	            <name>Check GPS enabled</name>
	            <visible>false</visible>
	            <changeValueJavaScript>checkbox</changeValueJavaScript>	 
	        </property>
	        
	        <property>
	            <key>onlineActions</key>
	            <name>Actions</name>
	            <visible>false</visible>
	            <changeValueJavaScript>childActions</changeValueJavaScript>	 
	        </property>
	        
	        <property>
	            <key>onlineWorking</key>
	            <name>Working dialogue</name>
	            <visible>false</visible>
	            <changeValueJavaScript>navigationPage</changeValueJavaScript>	 
	        </property>
	        
	        <property>
	            <key>onlineFail</key>
	            <name>Offline dialogue</name>
	            <visible>false</visible>
	            <changeValueJavaScript>navigationPage</changeValueJavaScript>	 
	        </property>
	        
	    </properties>
	    
		<resources>
		    
	        <resource>
	            <type>javascriptFile</type>
	            <contents>
	               scripts/controls/map.js
	            </contents>
            </resource>
            
		</resources>
	    
		<actionJavaScript>
	        <![CDATA[ 
	          
function Action_mobile(actionId, type) {
	// action callback
	alert("Callback for " + actionId + "." + type);
}	        

			]]>
	    </actionJavaScript>
	    
    </action> 
</actions>