<?xml version="1.0" encoding="ISO-8859-1" ?>
<actions xmlVersion="1" xmlns:xsi="http://www.w3.org/2001/XMLSchema-instance" xsi:noNamespaceSchemaLocation="../schemas/action.xsd">

<!-- 

Copyright (C) 2016 - Gareth Edwards / Rapid Information Systems

gareth.edwards@rapid-is.co.uk

This file is part of the Rapid Application Platform

Rapid is free software: you can redistribute it and/or modify
it under the terms of the GNU General Public License as published by
the Free Software Foundation, either version 3 of the License, or
(at your option) any later version. The terms require you to include
the original copyright, and the license notice in all redistributions.

This program is distributed in the hope that it will be useful,
but WITHOUT ANY WARRANTY; without even the implied warranty of
MERCHANTABILITY or FITNESS FOR A PARTICULAR PURPOSE.  See the
GNU General Public License for more details.

You should have received a copy of the GNU General Public License
in a file named "COPYING".  If not, see <http://www.gnu.org/licenses/>.

 -->

    <action>
    
        <type>listfolder</type>
        <name>List folder</name>
	    <class>com.rapid.actions.ListFolder</class>
	    
	    <properties>
	        <property>
	            <key>rootFolder</key>
	            <name>Root folder</name>
	            <changeValueJavaScript>text</changeValueJavaScript>
	            <helpHtml>Sets the folder to read the file properties from..</helpHtml>
	        </property>
	        
	        <property>
	            <key>dataDestination</key>
	            <name>Destination</name>
	            <changeValueJavaScript>select</changeValueJavaScript>
	            <getValuesFunction>
	                 <![CDATA[
	                // return the list of all controls on the page with the one for this action selected
	                return "<option value=''>Please select...</option>" + getOutputOptions(this.dataDestination);
	               	]]>
	            </getValuesFunction>
	            <helpHtml>Sets the destination for where the folder listing is being copied to.</helpHtml>
	        </property>
	        
	        <property>
	            <key>showHidden</key>
	            <name>Show hidden files</name>
	            <changeValueJavaScript>checkbox</changeValueJavaScript>
	            <getValuesFunction>return false;</getValuesFunction>
	            <helpHtml>Sets whether to show the hidden files in the current root or not.</helpHtml>
	        </property>
	    </properties>
	    		    	        
    </action> 
</actions>